[
  {
    "id": "pair",
    "kind": "procedure",
    "text": "Для связи используются WiFi-Bridge и пара виртуальных COM-портов. Программа для ЭБУ и WiFi-Bridge подключаются к разным концам этой пары. Выбор одного и того же конца обеими программами не обеспечивает связь. Пакетный обмен зависит от протокола ЭБУ и программы; это не ELM327/J2534.",
    "source_ids": ["bridge"],
    "status": "verified",
    "checked_by": "Редакционное чтение публичной документации, 2026-10-05; не испытание оборудования"
  },
  {
    "id": "network",
    "kind": "limitation",
    "text": "В FAQ выделен отдельный случай: беспроводное подключение есть, но WiFi-Bridge не устанавливает связь. Для диагностики нужно различать сетевое подключение и взаимодействие приложения с адаптером. Старый совет отключить защиту системы не используется в этом материале.",
    "source_ids": ["faq"],
    "status": "verified",
    "checked_by": "Редакционное чтение публичного FAQ, 2026-10-05; не испытание оборудования"
  }
]
